{
  "id": "xlsx_test_01",
  "format": "xlsx",
  "tier": "quality",
  "input": "tests/conversion_eval/fixtures/inputs/xlsx/test_01.xlsx",
  "description": "Workbook relationships, shared strings, and multi-sheet tables should render deterministically.",
  "must_include": ["Sheet1", "Sheet2", "Sheet3", "col-1", "header (f)"],
  "must_not_include": ["undefined", "xl/workbook.xml"],
  "min_chars": 150,
  "min_lines": 10,
  "golden_markdown": "tests/conversion_eval/fixtures/expected/markdown/xlsx_test_01.md",
  "reference_builder": "xlsx",
  "checks": {
    "anchors": true,
    "golden_markdown": true,
    "ast_compare": true,
    "table_compare": true,
    "text_order": false
  },
  "thresholds": {
    "table_compare": 0.77
  },
  "weights": {
    "anchors": 0.2,
    "noise_control": 0.1,
    "markdown_similarity": 0.3,
    "ast_similarity": 0.15,
    "table_similarity": 0.25
  },
  "notes": "The converter splits offset sub-tables into compact region tables while the reference builder emits one sheet-wide table with absolute column padding. The eval harness normalizes fully-empty rows/columns on both sides (normalize_table) and uses containment-based many-to-one pairing (run_eval.py many_to_one_table_similarity), so the metric compares cell semantics rather than layout representation. table_similarity measured 0.8531 after the <row r=\"N\"> fix; threshold set to ~90% of that."
}
